{
  "pmx_id": "PMX-DRPALMA-W3-3CLAVES-001",
  "case_type": "VIDEO",
  "controller": "DATA_CONTROLLER",
  "title": "Dr. Palma · 3 claves para Green Bay · Week 3",
  "created_at": "2026-09-22T16:38:26-06:00",
  "updated_at": "2026-09-22T21:58:26-06:00",
  "intake": {
    "mode": "MANUAL",
    "requested_output": "Vertical video · social distribution",
    "source_ref": "Video Factory / user-supplied approved audio"
  },
  "workflow": {
    "canonical": [
      "00",
      "01",
      "02",
      "03",
      "03.5",
      "04",
      "05"
    ],
    "current_stage": "05",
    "gate_state": "PUBLISHED",
    "history": [
      {
        "stage": "04",
        "state": "PASS",
        "note": "Final vertical render completed after subtitle safe-area patch."
      },
      {
        "stage": "05",
        "state": "PUBLISHED",
        "note": "Instagram and Facebook verified live; remaining manual channels confirmed by user without platform URL capture."
      }
    ]
  },
  "assignment": {
    "platforms": [
      "instagram",
      "facebook",
      "tiktok",
      "x",
      "whatsapp"
    ],
    "format": "VIDEO 9:16 · 1080x1920",
    "cta_required": false,
    "route_requirement": null
  },
  "routes": [],
  "controller_state": {
    "video_factory_prs": [
      "#10",
      "#12"
    ],
    "metricool_post_id": "380436235",
    "metricool_uuid": "625371536947889557"
  },
  "publication": {
    "firewall": "AUTHORIZED",
    "postpublication_qa": "PARTIAL",
    "platforms": {
      "instagram": {
        "status": "PUBLISHED",
        "url": "https://www.instagram.com/reel/DdnJCEgAOhh/",
        "external_id": "https://www.instagram.com/reel/DdnJCEgAOhh/",
        "operator": "Metricool",
        "published_at": "2026-09-22T19:32:00-06:00",
        "error": null
      },
      "facebook": {
        "status": "PUBLISHED",
        "url": "https://facebook.com/reel/1562444272233969",
        "external_id": "1562444272233969",
        "operator": "Metricool",
        "published_at": "2026-09-22T19:32:00-06:00",
        "error": null
      },
      "tiktok": {
        "status": "USER_CONFIRMED",
        "url": null,
        "external_id": null,
        "operator": "Manual",
        "published_at": null,
        "error": "Metricool auto-publish failed: account limit; manual completion reported by user."
      },
      "x": {
        "status": "USER_CONFIRMED",
        "url": null,
        "external_id": null,
        "operator": "Manual",
        "published_at": null,
        "error": null
      },
      "whatsapp": {
        "status": "USER_CONFIRMED",
        "url": null,
        "external_id": null,
        "operator": "Manual",
        "published_at": null,
        "error": null
      }
    }
  },
  "source_of_truth": [
    {
      "type": "GITHUB_PR",
      "ref": "#10",
      "note": "Week 3 Dr Palma production candidate merged."
    },
    {
      "type": "GITHUB_PR",
      "ref": "#12",
      "note": "Safe-area subtitle patch merged."
    },
    {
      "type": "METRICOOL",
      "ref": "380436235",
      "note": "IG + FB published; TikTok returned account-limit error."
    },
    {
      "type": "USER_CONFIRMATION",
      "ref": "current conversation",
      "note": "Manual distribution reported complete."
    }
  ],
  "evidence": {
    "status": "PARTIAL",
    "items": [
      {
        "type": "PUBLIC_URL",
        "platform": "instagram",
        "url": "https://www.instagram.com/reel/DdnJCEgAOhh/"
      },
      {
        "type": "PUBLIC_URL",
        "platform": "facebook",
        "url": "https://facebook.com/reel/1562444272233969"
      },
      {
        "type": "USER_CONFIRMATION",
        "platforms": [
          "tiktok",
          "x",
          "whatsapp"
        ],
        "note": "URLs/IDs not captured in system."
      }
    ]
  },
  "analysis": null
}
